{
  "entries": [
    {
      "kind": "workflow",
      "public": true,
      "publicCommand": {
        "description": "Build features, scoped refactors, docs, tests, or mixed changes.",
        "invocation": "/circuit:build",
        "shimPath": "commands/build.md",
        "slash": "/circuit:build"
      },
      "slug": "build"
    },
    {
      "kind": "utility",
      "public": true,
      "publicCommand": {
        "description": "Generate, validate, and publish a user-global custom circuit workflow.",
        "invocation": "/circuit:create",
        "shimPath": "commands/create.md",
        "slash": "/circuit:create"
      },
      "slug": "create"
    },
    {
      "kind": "workflow",
      "public": true,
      "publicCommand": {
        "description": "Investigate, understand, choose among options, or shape an execution plan.",
        "invocation": "/circuit:explore",
        "shimPath": "commands/explore.md",
        "slash": "/circuit:explore"
      },
      "slug": "explore"
    },
    {
      "kind": "utility",
      "public": true,
      "publicCommand": {
        "description": "Save, explicitly resume, or clear session continuity across session boundaries.",
        "invocation": "/circuit:handoff",
        "shimPath": "commands/handoff.md",
        "slash": "/circuit:handoff"
      },
      "slug": "handoff"
    },
    {
      "kind": "workflow",
      "public": true,
      "publicCommand": {
        "description": "Large-scale migrations: framework swaps, dependency replacements, architecture transitions, incremental rewrites.",
        "invocation": "/circuit:migrate",
        "shimPath": "commands/migrate.md",
        "slash": "/circuit:migrate"
      },
      "slug": "migrate"
    },
    {
      "kind": "workflow",
      "public": true,
      "publicCommand": {
        "description": "Fix bugs, regressions, flaky behavior, and incidents.",
        "invocation": "/circuit:repair",
        "shimPath": "commands/repair.md",
        "slash": "/circuit:repair"
      },
      "slug": "repair"
    },
    {
      "kind": "utility",
      "public": true,
      "publicCommand": {
        "description": "Standalone fresh-context code review.",
        "invocation": "/circuit:review",
        "shimPath": "commands/review.md",
        "slash": "/circuit:review"
      },
      "slug": "review"
    },
    {
      "kind": "workflow",
      "public": true,
      "publicCommand": {
        "description": "The primary Circuit router.",
        "invocation": "/circuit:run <task>",
        "shimPath": "commands/run.md",
        "slash": "/circuit:run"
      },
      "slug": "run"
    },
    {
      "kind": "workflow",
      "public": true,
      "publicCommand": {
        "description": "Systematic codebase sweeps: cleanup, quality passes, coverage improvements, docs-sync.",
        "invocation": "/circuit:sweep",
        "shimPath": "commands/sweep.md",
        "slash": "/circuit:sweep"
      },
      "slug": "sweep"
    },
    {
      "kind": "adapter",
      "public": false,
      "slug": "workers"
    }
  ],
  "files": [
    {
      "executable": false,
      "path": ".claude-plugin/marketplace.json",
      "sha256": "dd39ba0485922220e9c43975b8e2402a0883c14f7062ab131fe4fe4e2d527597"
    },
    {
      "executable": false,
      "path": ".claude-plugin/plugin.json",
      "sha256": "a1f47b5391a2a36eae8a96018114be3ca65ba7cd43f89c8de922a986b956e992"
    },
    {
      "executable": false,
      "path": ".claude-plugin/public-commands.txt",
      "sha256": "f2147c5522979012a0e385c2c7514e8663e45fe786aebf75cae64a595d63819b"
    },
    {
      "executable": false,
      "path": ".rgignore",
      "sha256": "c3f74479e391b590ef57ab32cc969a381fd585aa824f8bad4fd55b2207c2c5ad"
    },
    {
      "executable": false,
      "path": "circuit.config.example.yaml",
      "sha256": "3a04057cb3275a41f269442ffdb313b022f06c75d51fc9aaaded74b82d3489ca"
    },
    {
      "executable": false,
      "path": "commands/build.md",
      "sha256": "62057ddc1e79492095ef922228859afc29a1a88a1100699839299b38a7ff15be"
    },
    {
      "executable": false,
      "path": "commands/create.md",
      "sha256": "771632a1613ee7e98242ac5eb455c1c432a79c268260794f40628707795da729"
    },
    {
      "executable": false,
      "path": "commands/explore.md",
      "sha256": "c4a0ab7c86f6f27a56a7283343d18937929f500f3b715b7b5e1498bf8b8b2122"
    },
    {
      "executable": false,
      "path": "commands/handoff.md",
      "sha256": "c16188ef6a9877bc25820fdaaa09d6e4fa238f743bf997216ba59020ae994044"
    },
    {
      "executable": false,
      "path": "commands/migrate.md",
      "sha256": "c3bf900f5aacb7bd696f9d9ed79254b2f5253f82c4e876abb39a8b053737b811"
    },
    {
      "executable": false,
      "path": "commands/repair.md",
      "sha256": "3b0e03c90a5a222ff88db508bdfb30de3201ee26f19e5b6bd18625003044c36d"
    },
    {
      "executable": false,
      "path": "commands/review.md",
      "sha256": "421c06e765e2da5c1e5de620f9727c1332be60ae3a2c7475aba4d9eb8f2ff76d"
    },
    {
      "executable": false,
      "path": "commands/run.md",
      "sha256": "47f51afcbc1735211791e80e18c8f16ce8faa67689311c158aa2b729dda453b9"
    },
    {
      "executable": false,
      "path": "commands/sweep.md",
      "sha256": "1ca1e2e1f38060983e0f8689052e5161a9de8c29b6eaf16ac588f1a0a73b4131"
    },
    {
      "executable": false,
      "path": "hooks/hooks.json",
      "sha256": "ec60f17560be3a2c00fce9769dcd3d5a945391bde2fa46b5548cd33de6c725d0"
    },
    {
      "executable": true,
      "path": "hooks/session-start.sh",
      "sha256": "9d34e077f36afa9a322d6db20c0c4f343d5d012a9305c4ef728e5052b5d96746"
    },
    {
      "executable": true,
      "path": "hooks/user-prompt-submit.js",
      "sha256": "1dfc1f0a20a5f6f03811a13fb3bc3eab3033c14d830b443d3e3fc0432c4a916f"
    },
    {
      "executable": false,
      "path": "schemas/circuit-manifest.schema.json",
      "sha256": "26da20b64f2d736bc67d38512fbc87fa33ff7b98387f9b0fd0e008b1f4c171b2"
    },
    {
      "executable": false,
      "path": "schemas/continuity-index.schema.json",
      "sha256": "e6fdd66b26aee01b2d10187b7a1ea731329a9549f1290114d43553c27bafae50"
    },
    {
      "executable": false,
      "path": "schemas/continuity-record.schema.json",
      "sha256": "c03f15b927379ed3e8853fbb9c264204335a1e7ce3e3a6fcf4e0a8d8247886d3"
    },
    {
      "executable": false,
      "path": "schemas/event.schema.json",
      "sha256": "61404e1633fa8b81093409657fc35fe455715fd7ec942b66faf2c4e91d594f9d"
    },
    {
      "executable": false,
      "path": "schemas/invocation-ledger.schema.json",
      "sha256": "4073e26c709755b713c1704e914685a20690624cdd78b2dda3a449dc240d4c1e"
    },
    {
      "executable": false,
      "path": "schemas/job-result.schema.json",
      "sha256": "2d6794f12a6cd9d3023d031658f022b21c553ac4bc1c13254285a451bb0366ed"
    },
    {
      "executable": false,
      "path": "schemas/state.schema.json",
      "sha256": "38eed83eac54b706aa186812b66001a028a4a84fdab5b545655fb12d843e7598"
    },
    {
      "executable": false,
      "path": "schemas/surface-manifest.schema.json",
      "sha256": "2f2019bcb0d7fcea5042120237155076d29be9ba2cc44eeb898af2f6540e1804"
    },
    {
      "executable": true,
      "path": "scripts/relay/circuit-engine.sh",
      "sha256": "671a344569bf5fab862f22b201f5528e2027ec76b772c78976542a0557cd0931"
    },
    {
      "executable": true,
      "path": "scripts/relay/compose-prompt.sh",
      "sha256": "df14fd7d41297157f37a80be994299bc54c9f93a8a5bd3b319513d78aaa64312"
    },
    {
      "executable": true,
      "path": "scripts/relay/dispatch.sh",
      "sha256": "54aac19eaefa333fc09816176942db1cf1e1cb1c0950f2819bf745009d1291da"
    },
    {
      "executable": true,
      "path": "scripts/relay/update-batch.sh",
      "sha256": "49fcb68b2f1fc947e8d5df945f9c4e70c6e437dc4c07eb06c8c3c5804f938d69"
    },
    {
      "executable": true,
      "path": "scripts/runtime/bin/abort-stuck-runs.sh",
      "sha256": "1e7cdbe8c50901a43b8db11ffaea764e3b897ddb1465b7ea30d6b3cba7788ffb"
    },
    {
      "executable": true,
      "path": "scripts/runtime/bin/append-event.js",
      "sha256": "581a9c6b83f7b49471e2685a43a82fa183b74daf381ca789c861f244383da750"
    },
    {
      "executable": true,
      "path": "scripts/runtime/bin/catalog-compiler.js",
      "sha256": "8220ba0a09751fe3f3e468b12b13cb2ac02430e6515f587fe7c1a95b934dd276"
    },
    {
      "executable": true,
      "path": "scripts/runtime/bin/circuit-engine.js",
      "sha256": "3b47e15889c18c25a73b25f0ac868be6ed7346a6fd65694ca5fdafe05be35548"
    },
    {
      "executable": true,
      "path": "scripts/runtime/bin/continuity.js",
      "sha256": "6ea14ef033b50ed0e94272db4d81977df431dd9579939416916c209f67374121"
    },
    {
      "executable": true,
      "path": "scripts/runtime/bin/custom-circuits.js",
      "sha256": "dbb7825ccf77be6971f4d89ab18912fb7e35f66f4022f0115e439d9cfe0695ea"
    },
    {
      "executable": true,
      "path": "scripts/runtime/bin/derive-state.js",
      "sha256": "977e6016fad5556a239810f1ff6294f16419e87e85f409b99824b9f33cdd5c84"
    },
    {
      "executable": true,
      "path": "scripts/runtime/bin/dispatch.js",
      "sha256": "26a1bda4dc7bc5b032a61727ccacced63eb2569d1dc9763884aa34f50a14eae5"
    },
    {
      "executable": true,
      "path": "scripts/runtime/bin/list-installed-surface-roots.js",
      "sha256": "db474e2fc022f64586f8c1f9af7b9082488de0c393cf1bc8661666e06ad41ec2"
    },
    {
      "executable": true,
      "path": "scripts/runtime/bin/read-config.js",
      "sha256": "6cf5c1a98389be327811b5fc90c96a90ee84bf77624cd6936d5424d72d2729dc"
    },
    {
      "executable": true,
      "path": "scripts/runtime/bin/reap-legacy-handoffs.sh",
      "sha256": "51a0acddc90e97c412f655eadd15af3cadd30be59bc17727794688ffa604e71e"
    },
    {
      "executable": true,
      "path": "scripts/runtime/bin/resume.js",